{
  "schema_version": 1,
  "provider": "deepseek-v4-flash",
  "model": "deepseek-v4-flash",
  "protocol": "openai_responses",
  "policy": {
    "max_total_cost_microunits": 1000000,
    "require_cost_known": true,
    "pricing_contract": "deepseek_v4_2026_08_17"
  },
  "scenarios": [
    {
      "id": "exact-response",
      "mode": "single",
      "repetitions": 8,
      "command": ["make", "deepseek-live-smoke"],
      "expected_text_sha256": "sha256:29ead32f8ad74da1774035001bfdc5635548b32871109bec3b23f6d1866960ac",
      "min_confidence_lower_basis_points": 6700,
      "max_p95_latency_ms": 180000,
      "max_cost_microunits": 50000,
      "max_event_shape_variants": 2
    },
    {
      "id": "multi-agent",
      "mode": "multi_agent",
      "repetitions": 4,
      "command": ["make", "deepseek-multi-agent-smoke"],
      "expected_text_sha256": "sha256:65fb349210925e252cf30be3291ed5575cc269162c7e1ea742a47d50747fb982",
      "min_confidence_lower_basis_points": 5000,
      "max_p95_latency_ms": 300000,
      "max_cost_microunits": 200000,
      "max_event_shape_variants": 3
    }
  ]
}
